{
  "schema_version": "1.1.0",
  "release": {
    "name": "codex-game-atelier",
    "version": "0.3.0-rc.6",
    "repository": "Leon0555/codex-game-atelier",
    "source_revision": "cad37695219946c751cf3ebaa5ecd6dfd31d9fc1",
    "distribution_manifest_sha256": "18172e2a48cb49249374bca8ad2c960e719450d79b51f1fe9f156a410b83a651",
    "plugin_archive_sha256": "cf9512224dc7b33c96f59b28cd5456a196b6d463297fa9b6876ae03b2982ceda"
  },
  "remote_plugin_install": {
    "outcome": "PASS",
    "source": "github",
    "repository": "Leon0555/codex-game-atelier",
    "marketplace_ref": "marketplace/v0.3.0-rc.6",
    "marketplace_revision": "29b25e51b8e79ba948c4c75b2104abfc0b1e1096",
    "installed_version": "0.3.0-rc.6",
    "candidate_archive_sha256": "cf9512224dc7b33c96f59b28cd5456a196b6d463297fa9b6876ae03b2982ceda",
    "observed_at": "2026-09-08T01:49:02Z",
    "codex_cli_version": "codex-cli 0.153.4",
    "host": "macos",
    "architecture": "arm64",
    "godot_version": "4.7.2-stable",
    "gatekeeper_intervention": false,
    "system_settings_override": false,
    "quarantine_removed": false,
    "cli_smoke": "PASS",
    "private_runner_refusal": "PASS",
    "starter_create": "PASS",
    "new_task_skill_discovery": "PASS",
    "skill_discovery": {
      "outcome": "PASS",
      "thread_id": "01a07eac-e94f-7261-89b9-c9a9678b935c",
      "skill_name": "codex-game-atelier:develop-godot-game",
      "entry_relative_path": "skills/develop-godot-game/SKILL.md"
    },
    "headless_validation": "PASS",
    "gdscript_tests": "PASS",
    "gdscript_test_count": 6,
    "lifecycle": {
      "outcome": "PASS",
      "upgrade_from_version": "0.3.0-rc.5",
      "upgrade_to_version": "0.3.0-rc.6",
      "successful_upgrade": "PASS",
      "failed_upgrade_rejected": "PASS",
      "failed_upgrade_active_version": "0.3.0-rc.6",
      "rollback_to_version": "0.3.0-rc.5",
      "rollback": "PASS",
      "uninstall_and_state_restore": "PASS",
      "operations": [
        {
          "id": "baseline-install",
          "outcome": "PASS",
          "exit_code": 0,
          "active_version": "0.3.0-rc.5"
        },
        {
          "id": "upgrade-to-candidate",
          "outcome": "PASS",
          "exit_code": 0,
          "active_version": "0.3.0-rc.6"
        },
        {
          "id": "invalid-upgrade-rejected",
          "outcome": "PASS",
          "exit_code": 1,
          "active_version": "0.3.0-rc.6"
        },
        {
          "id": "rollback-to-previous",
          "outcome": "PASS",
          "exit_code": 0,
          "active_version": "0.3.0-rc.5"
        },
        {
          "id": "candidate-reinstall",
          "outcome": "PASS",
          "exit_code": 0,
          "active_version": "0.3.0-rc.6"
        },
        {
          "id": "plugin-uninstall",
          "outcome": "PASS",
          "exit_code": 0
        },
        {
          "id": "marketplace-remove",
          "outcome": "PASS",
          "exit_code": 0
        },
        {
          "id": "config-state-restore",
          "outcome": "PASS",
          "exit_code": 0
        }
      ],
      "state_before": {
        "installed_plugin_count": 14,
        "installed_plugin_ids_sha256": "88cc8c979f040b7b9774f4ab6198d0530610fecf6a389048ca5a413f87404341",
        "marketplace_count": 6,
        "marketplace_names_sha256": "fa7db3991654ad43637e2b48b948bcce8b340d10adf1dd84faf97bd04653ae2d",
        "atelier_plugin_count": 0,
        "atelier_marketplace_count": 0,
        "config_mode": "0600",
        "config_byte_size": 5955,
        "config_sha256": "cbc4faaece632f785d8d3441216fbf2a39f85c493372217eaba9815f39bfe262"
      },
      "state_after": {
        "installed_plugin_count": 14,
        "installed_plugin_ids_sha256": "88cc8c979f040b7b9774f4ab6198d0530610fecf6a389048ca5a413f87404341",
        "marketplace_count": 6,
        "marketplace_names_sha256": "fa7db3991654ad43637e2b48b948bcce8b340d10adf1dd84faf97bd04653ae2d",
        "atelier_plugin_count": 0,
        "atelier_marketplace_count": 0,
        "config_mode": "0600",
        "config_byte_size": 5955,
        "config_sha256": "cbc4faaece632f785d8d3441216fbf2a39f85c493372217eaba9815f39bfe262"
      }
    }
  },
  "required_ci": {
    "outcome": "PASS",
    "provider": "github-actions",
    "repository": "Leon0555/codex-game-atelier",
    "workflow_path": ".github/workflows/ci.yml",
    "job_name": "verify-macos-arm64",
    "run_id": 34175920843,
    "run_url": "https://github.com/Leon0555/codex-game-atelier/actions/runs/34175920843",
    "head_sha": "cad37695219946c751cf3ebaa5ecd6dfd31d9fc1",
    "event": "push",
    "branch": "main",
    "branch_protection_required": true,
    "branch_protection": {
      "observed_at": "2026-09-08T01:49:02Z",
      "repository": "Leon0555/codex-game-atelier",
      "branch": "main",
      "required_check": "verify-macos-arm64",
      "strict": true,
      "enforce_admins": true,
      "allow_force_pushes": false,
      "allow_deletions": false,
      "required_signatures": false
    }
  },
  "recorded_at": "2026-09-08T01:49:02Z"
}
